[
  {
    "sourceId": "atlas-figma-BillingV2UI",
    "source": "figma",
    "squadId": "atlas",
    "title": "Billing Portal UI — v2 Redesign",
    "url": "https://www.figma.com/file/aT1b2c3d4e5f/Billing-Portal-v2",
    "lastUpdated": "2026-05-13T11:00:00Z",
    "raw": {
      "file_key": "aT1b2c3d4e5f",
      "file_name": "Billing Portal UI — v2 Redesign",
      "last_modified": "2026-05-13T11:00:00Z",
      "comments": [
        {
          "author": "alice-design",
          "text": "Invoice list view updated — added 'Plan tier' column per PM request. Loading skeleton states added. Error states for 5xx responses added. Ready for dev handoff on happy path.",
          "created_at": "2026-05-12T10:00:00Z",
          "resolved": true
        },
        {
          "author": "sarah-chen",
          "text": "Still need the 429 rate limit error state. PR #48 (rate limiting) is in review and will merge this week. The 429 toast and error message need to be finalized before we can consider the billing UI fully designed.",
          "created_at": "2026-05-13T09:30:00Z",
          "resolved": false
        },
        {
          "author": "alice-design",
          "text": "On my list — I'll get to it after I finish the mobile responsive breakpoints. Should be in the file by Thursday.",
          "created_at": "2026-05-13T11:00:00Z",
          "resolved": false
        }
      ]
    }
  },
  {
    "sourceId": "atlas-figma-PremiumTierFlow",
    "source": "figma",
    "squadId": "atlas",
    "title": "Premium Tier — Upgrade Flow & Entitlement Gates",
    "url": "https://www.figma.com/file/pR3m1u2m3t4i/Premium-Tier-Flow",
    "lastUpdated": "2026-05-15T14:00:00Z",
    "raw": {
      "file_key": "pR3m1u2m3t4i",
      "file_name": "Premium Tier — Upgrade Flow & Entitlement Gates",
      "last_modified": "2026-05-15T14:00:00Z",
      "comments": [
        {
          "author": "alice-design",
          "text": "Locked and unlocked feature gate states added to the premium tier flow. Using the scopes provided by eng: `billing:write`, `analytics:read`, `premium:access`. Gated features shown with a lock icon and upsell tooltip.",
          "created_at": "2026-05-15T14:00:00Z",
          "resolved": false
        },
        {
          "author": "jordan-lee",
          "text": "Looks great. Once auth v2 lands and we can wire the LaunchDarkly flags (PR #57), we'll be able to implement against this.",
          "created_at": "2026-05-15T15:00:00Z",
          "resolved": false
        }
      ]
    }
  }
]
