[
  {
    "sourceId": "lumen-figma-AuthV2TokenDesign",
    "source": "figma",
    "squadId": "lumen",
    "title": "Auth Tokens v2 — API Payload Design",
    "url": "https://www.figma.com/file/lN1a2u3t4h5v/Auth-Tokens-v2",
    "lastUpdated": "2026-05-15T10:00:00Z",
    "raw": {
      "file_key": "lN1a2u3t4h5v",
      "file_name": "Auth Tokens v2 — API Payload Design",
      "last_modified": "2026-05-15T10:00:00Z",
      "comments": [
        {
          "author": "priya-nair",
          "text": "PM signed off on scopes schema Friday. v2 payload finalized: `tenantId` string + `scopes` string array using resource:action format. Implementation complete — PR #31 in final code review. Closing this comment thread.",
          "created_at": "2026-05-15T10:00:00Z",
          "resolved": true
        },
        {
          "author": "kai-zhang",
          "text": "Excellent. Atlas team can reference this spec when they implement the migration — the `scopes` field is the gating mechanism they need for premium tier flags.",
          "created_at": "2026-05-15T10:30:00Z",
          "resolved": true
        }
      ]
    }
  },
  {
    "sourceId": "lumen-figma-ComponentLibraryTokens",
    "source": "figma",
    "squadId": "lumen",
    "title": "Lumen Component Library — Design Token Spec",
    "url": "https://www.figma.com/file/lC0m1p2t3k4l/Component-Library-Tokens",
    "lastUpdated": "2026-05-14T16:00:00Z",
    "raw": {
      "file_key": "lC0m1p2t3k4l",
      "file_name": "Lumen Component Library — Design Token Spec",
      "last_modified": "2026-05-14T16:00:00Z",
      "comments": [
        {
          "author": "alice-design",
          "text": "Added skeleton loader variants to the token spec — shimmer animation values and background color tokens. Dev can reference these for LMNE-24.",
          "created_at": "2026-05-13T15:00:00Z",
          "resolved": false
        },
        {
          "author": "dev-okonkwo",
          "text": "Got the skeleton tokens. Building the loader components now. Should be ready for review by end of week.",
          "created_at": "2026-05-14T16:00:00Z",
          "resolved": false
        }
      ]
    }
  },
  {
    "sourceId": "lumen-figma-AccessibilityAuditFixes",
    "source": "figma",
    "squadId": "lumen",
    "title": "Accessibility Audit — Form Input Fixes",
    "url": "https://www.figma.com/file/lA1c2c3e4s5s/Accessibility-Form-Fixes",
    "lastUpdated": "2026-05-14T13:00:00Z",
    "raw": {
      "file_key": "lA1c2c3e4s5s",
      "file_name": "Accessibility Audit — Form Input Fixes",
      "last_modified": "2026-05-14T13:00:00Z",
      "comments": [
        {
          "author": "alice-design",
          "text": "Updated all form input designs with visible focus rings (4px solid #0070F3 at 2px offset) and ARIA label specs. The designs match the axe-compliant implementation in PR #38.",
          "created_at": "2026-05-14T13:00:00Z",
          "resolved": false
        },
        {
          "author": "priya-nair",
          "text": "Good — design and code are in sync here. PR #38 should match this spec exactly.",
          "created_at": "2026-05-14T13:30:00Z",
          "resolved": true
        }
      ]
    }
  }
]
