[
  {
    "sourceId": "atlas-figma-BillingV2UI",
    "source": "figma",
    "squadId": "atlas",
    "title": "Billing Portal UI — v2 Redesign",
    "url": "https://www.figma.com/file/aT1b2c3d4e5f/Billing-Portal-v2",
    "lastUpdated": "2026-05-20T14:00:00Z",
    "raw": {
      "file_key": "aT1b2c3d4e5f",
      "file_name": "Billing Portal UI — v2 Redesign",
      "last_modified": "2026-05-20T14:00:00Z",
      "comments": [
        {
          "author": "alice-design",
          "text": "Invoice list view updated — added 'Plan tier' column per PM request. Ready for dev handoff.",
          "created_at": "2026-05-19T11:00:00Z",
          "resolved": true
        },
        {
          "author": "sarah-chen",
          "text": "Rate limiting error state: the 429 toast is cut off on mobile viewports below 375px. Can we adjust the max-width?",
          "created_at": "2026-05-20T10:30:00Z",
          "resolved": false
        },
        {
          "author": "alice-design",
          "text": "Good catch, updated — the toast now wraps instead of clipping. @sarah-chen please re-check.",
          "created_at": "2026-05-20T14:00:00Z",
          "resolved": false
        }
      ]
    }
  },
  {
    "sourceId": "atlas-figma-PremiumTierFlow",
    "source": "figma",
    "squadId": "atlas",
    "title": "Premium Tier — Upgrade Flow & Entitlement Gates",
    "url": "https://www.figma.com/file/pR3m1u2m3t4i/Premium-Tier-Flow",
    "lastUpdated": "2026-05-22T16:30:00Z",
    "raw": {
      "file_key": "pR3m1u2m3t4i",
      "file_name": "Premium Tier — Upgrade Flow & Entitlement Gates",
      "last_modified": "2026-05-22T16:30:00Z",
      "comments": [
        {
          "author": "alice-design",
          "text": "Upgrade modal: added social proof section (customer logos) per growth team request. Three variants in the file — Dev, please implement the 'B' variant first for the A/B test.",
          "created_at": "2026-05-21T09:00:00Z",
          "resolved": false
        },
        {
          "author": "jordan-lee",
          "text": "Feature flag gate: the 'lock' icon on gated features — should it show a tooltip on hover explaining what plan unlocks it? Not in the current spec.",
          "created_at": "2026-05-22T14:00:00Z",
          "resolved": false
        },
        {
          "author": "alice-design",
          "text": "@jordan-lee Yes — tooltip added in the updated frames (frame 14B). Copy: 'Upgrade to Premium to unlock this feature.'",
          "created_at": "2026-05-22T16:30:00Z",
          "resolved": true
        }
      ]
    }
  },
  {
    "sourceId": "atlas-figma-BillingEmailTemplates",
    "source": "figma",
    "squadId": "atlas",
    "title": "Billing Transactional Email Templates",
    "url": "https://www.figma.com/file/eM4i1l5t6e7m/Billing-Email-Templates",
    "lastUpdated": "2026-05-21T10:00:00Z",
    "raw": {
      "file_key": "eM4i1l5t6e7m",
      "file_name": "Billing Transactional Email Templates",
      "last_modified": "2026-05-21T10:00:00Z",
      "comments": [
        {
          "author": "alice-design",
          "text": "Updated payment failure and renewal reminder templates. Brand refresh tokens applied. Ready for HTML export.",
          "created_at": "2026-05-21T10:00:00Z",
          "resolved": false
        }
      ]
    }
  }
]
